<?xml version="1.0" encoding="UTF-8"?>
<!--

Licensed to Jasig under one or more contributor license
agreements. See the NOTICE file distributed with this work
for additional information regarding copyright ownership.
Jasig licenses this file to you under the Apache License,
Version 2.0 (the "License"); you may not use this file
except in compliance with the License. You may obtain a
copy of the License at:

http://www.apache.org/licenses/LICENSE-2.0

Unless required by applicable law or agreed to in writing,
software distributed under the License is distributed on
an "AS IS" BASIS, WITHOUT WARRANTIES OR CONDITIONS OF ANY
KIND, either express or implied. See the License for the
specific language governing permissions and limitations
under the License.

-->
<schema xmlns="http://www.w3.org/2001/XMLSchema"
        targetNamespace="http://http://www.jasig.org//ConfigDataTableSchema"
        xmlns:tns="http://http://www.jasig.org//ConfigDataTableSchema"
        elementFormDefault="qualified">

    <element name="configData">
        <complexType>
            <sequence>
                <element name="table" minOccurs="1" maxOccurs="unbounded">
                    <complexType>
                        <sequence>
                            <element name="column" minOccurs="1"
                                     maxOccurs="unbounded">
                                <complexType>
                                    <attribute name="columnName" type="string"
                                               use="required"/>
                                </complexType>
                            </element>
                        </sequence>
                        <attribute name="tableName" type="string"
                                   use="required"/>
                    </complexType>
                </element>
            </sequence>
        </complexType>
    </element>

</schema>